{"schema_version":"t3n-invocation-evidence-v1","tenant_did":"did:t3n:ad146e6861ac408900af7ece1f6e90976dad3a02","contract_tail":"adn-processor","contract_version":"3.9.2","invocation_id":"tee-del-2c970ed3f7ff0514a6069aad8ed96b05","worker_did":"c096c6f873f6","action":"PROCESS_DATA","request_digest":"ace6a9cb87e1b6fc0ddc359f6e2e3aeeaa860bec287d5e0c3daf29e93329c36d","result_digest":"365796177674c99a4c62cbd2584e79d00f990a29e88b2ef0a25370b0d1e7278a","issued_at":"2026-06-28T10:16:02Z","raw_platform_receipt":{"authorization_expires_at":"2026-06-28T10:16:02Z","build_config_id":"adn-build-977ac2f175ba0f69a10345ba4a13efd2","credential_enforced":true,"credential_fingerprint":"8998bbfe255c0a91cecfee1ad5c056d5f784037e0f62c8474f2a74bca1fcf4aa","delegation_id":"tee-del-2c970ed3f7ff0514a6069aad8ed96b05","routed_to":"c096c6f873f6","status":"ROUTED","user_signer":"0xb5a5808b97bdef6b053bb110be63af0deec60ed9"},"platform_credential_fingerprint":"8998bbfe255c0a91cecfee1ad5c056d5f784037e0f62c8474f2a74bca1fcf4aa","platform_credential_enforced":true,"evidence_mode":"t3n_attested"}